{
  "id": "bo-live-shenzhen",
  "type": "node",
  "title": "BO LIVE Shenzhen",
  "year": "2025",
  "category": "Live Performance / Audiovisual Collaboration",
  "summary": "A public live collaboration node for TITAN at BO LIVE Shenzhen.",
  "relatedWork": "kashiwa-titan",
  "relatedPeople": [
    "ewan-qian"
  ],
  "relatedVenue": "",
  "assets": [],
  "externalLinks": [
    "https://kashiwadaisuke.com/2025/10/28/can-festival-shenzhen-bo-live/"
  ]
}
